<!--

    Licensed to Jasig under one or more contributor license
    agreements. See the NOTICE file distributed with this work
    for additional information regarding copyright ownership.
    Jasig licenses this file to you under the Apache License,
    Version 2.0 (the "License"); you may not use this file
    except in compliance with the License. You may obtain a
    copy of the License at:

    http://www.apache.org/licenses/LICENSE-2.0

    Unless required by applicable law or agreed to in writing,
    software distributed under the License is distributed on
    an "AS IS" BASIS, WITHOUT WARRANTIES OR CONDITIONS OF ANY
    KIND, either express or implied. See the License for the
    specific language governing permissions and limitations
    under the License.

-->

<xs:schema xmlns="https://source.jasig.org/schemas/portlet/courses/course-summary"
    targetNamespace="https://source.jasig.org/schemas/portlet/courses/course-summary"
    xmlns:xs="http://www.w3.org/2001/XMLSchema" xmlns:xsi="http://www.w3.org/2001/XMLSchema-instance"
    elementFormDefault="qualified" attributeFormDefault="unqualified" version="1.0">
    
    <xs:element name="course-term-summary">
        <xs:complexType>
            <xs:sequence>
                <xs:element name="term-summary" type="term-summary">
                    <!-- Enforce terms having unique codes -->
                    <xs:unique name="unique_term_by_code">
                        <xs:selector xpath="term"/>
                        <xs:field xpath="code"/>
                    </xs:unique>
                </xs:element>
                <xs:element name="course-summary" type="course-summary" minOccurs="0" maxOccurs="unbounded" />
            </xs:sequence>
        </xs:complexType>
        <!-- Enforce course-summary having unique term_codes -->
        <xs:unique name="unique_course-summary_by_term-code">
            <xs:selector xpath="*/course-summary"/>
            <xs:field xpath="term_code"/>
        </xs:unique>
    </xs:element>
    
    <xs:complexType name="term-summary">
        <xs:sequence>
            <xs:element name="term" type="term" minOccurs="0" maxOccurs="unbounded"/>
        </xs:sequence>
    </xs:complexType>
    
    <xs:complexType name="course-summary">
        <xs:sequence>
            <xs:element name="term_code" type="xs:string"/>
            <xs:element name="gpa" type="xs:double" minOccurs="0"/>
            <xs:element name="credits" type="xs:double" minOccurs="0"/>
            <xs:element name="course" type="course" minOccurs="0" maxOccurs="unbounded">
                <!-- Enforce course-summary/course having unique code within the term -->
                <xs:unique name="unique_course-summary_course_by_term-code">
                    <xs:selector xpath="."/>
                    <xs:field xpath="code"/>
                </xs:unique>
            </xs:element>
        </xs:sequence>
    </xs:complexType>

    <xs:complexType name="term">
        <xs:sequence>
            <xs:element name="displayName" type="xs:string"/>
            <xs:element name="code" type="xs:string" minOccurs="0"/>
            <xs:element name="year" type="xs:integer" minOccurs="0"/>
            <xs:element name="termType" type="xs:string" minOccurs="0"/>
        </xs:sequence>
        <xs:attribute name="current" type="xs:boolean" default="false"/>
    </xs:complexType>

    <xs:complexType name="course">
        <xs:sequence>
            <xs:element name="title" type="xs:string"/>
            <xs:element name="code" type="xs:string"/>
            <xs:element name="school" type="xs:string" minOccurs="0"/>
            <xs:element name="location" type="location" minOccurs="0"/>
            <xs:element name="meetingTimes" type="xs:string" minOccurs="0"/>
            <xs:element name="url" type="xs:string"/>
            <xs:element name="instructor" type="instructor" minOccurs="0" maxOccurs="unbounded"/>
            <xs:element name="grade" type="xs:string" minOccurs="0"/>
            <xs:element name="credits" type="xs:double" minOccurs="0"/>
            <xs:element name="course-update" type="course-update" minOccurs="0" maxOccurs="unbounded"/>
        </xs:sequence>
    </xs:complexType>

    <xs:complexType name="instructor">
        <xs:sequence>
            <xs:element name="abbreviation" type="xs:string"/>
            <xs:element name="fullName" type="xs:string"/>
            <xs:element name="identifier" type="xs:string"/>
        </xs:sequence>
    </xs:complexType>
    
    <xs:complexType name="location">
            <xs:sequence>
                <xs:element name="displayName" type="xs:string"/>
                <xs:element name="identifier" type="xs:string"/>
            </xs:sequence>
    </xs:complexType>
    
    <xs:complexType name="course-update">
            <xs:sequence>
                <xs:element name="title" type="xs:string"/>
                <xs:element name="description" type="xs:string"/>
                <xs:element name="url" type="xs:string"/>
            </xs:sequence>
            <xs:attribute name="newUpdate" type="xs:boolean"/>
            <xs:attribute name="type" type="xs:string"/>
    </xs:complexType>
    
</xs:schema>
