<!--

    Licensed to Jasig under one or more contributor license
    agreements. See the NOTICE file distributed with this work
    for additional information regarding copyright ownership.
    Jasig licenses this file to you under the Apache License,
    Version 2.0 (the "License"); you may not use this file
    except in compliance with the License. You may obtain a
    copy of the License at:

    http://www.apache.org/licenses/LICENSE-2.0

    Unless required by applicable law or agreed to in writing,
    software distributed under the License is distributed on
    an "AS IS" BASIS, WITHOUT WARRANTIES OR CONDITIONS OF ANY
    KIND, either express or implied. See the License for the
    specific language governing permissions and limitations
    under the License.

-->
<course-summary
    xmlns="https://source.jasig.org/schemas/portlet/courses/course-summary"
    xmlns:xsi="http://www.w3.org/2001/XMLSchema-instance"
    xsi:schemaLocation="https://source.jasig.org/schemas/portlet/courses/course-summary ../../../../../courses-portlet-api/src/main/resources/xsd/generic/course-summary.xsd">

    <gpa>3.25</gpa>
    <credits>40</credits>

    <term>
        <displayName>Winter 2012</displayName>
        <code>2012w</code>
        <gpa>3.0</gpa>
        <credits>20</credits>
    </term>

    <term current="true">
        <displayName>Spring 2012</displayName>
        <code>2012s</code>
        <gpa>3.5</gpa>
        <credits>20</credits>
    
        <course>
            <title>Design Awareness</title>
            <code>DSC 101</code>
            <school>School of Design</school>
            <location>
                <displayName>SSS 114</displayName>
                <identifier>SSS</identifier>
            </location>
            <meetingTimes>M-W-F, 1:30-2:30pm</meetingTimes>
            <url>http://courses.university.edu/dsc101/s11</url>
            <instructor>
                <abbreviation>Faculty</abbreviation>
                <fullName>Joe Faculty, Phd</fullName>
                <identifier>faculty</identifier>
            </instructor>
            <grade>A</grade>
            <credits>4</credits>
            <course-update newUpdate="true" type="announcement">
                <title>Guest Lecture Thursday</title>
                <description>
                Don't miss Thursday's guest lecture by Alan Cooper
            </description>
                <url>http://courses.university.edu/dsc101/s11/announcements/1.html</url>
            </course-update>
        </course>

        <course>
            <title>Drawing for Industry</title>
            <code>IND 120</code>
            <school>School of Design</school>
            <location>
                <displayName>LC 101</displayName>
                <identifier>LC</identifier>
            </location>
            <meetingTimes>M-W-F, 1:30-2:30pm</meetingTimes>
            <url>http://courses.university.edu/dsc101/s11</url>
            <instructor>
                <abbreviation>Staff</abbreviation>
                <fullName>Sam Staff</fullName>
                <identifier>staff</identifier>
            </instructor>
            <grade>A</grade>
            <credits>4</credits>
            <course-update newUpdate="false" type="announcement">
                <title>Guest Lecture Thursday</title>
                <description>
                Don't miss Thursday's guest lecture by Alan Cooper
            </description>
                <url>http://courses.university.edu/dsc101/s11/announcements/1.html</url>
            </course-update>
        </course>

        <course>
            <title>First-Year Composition</title>
            <code>ENG 101</code>
            <school>School of Design</school>
            <location>
                <displayName>SCL 115</displayName>
                <identifier>SCL</identifier>
            </location>
            <meetingTimes>M-W-F, 1:30-2:30pm</meetingTimes>
            <url>http://courses.university.edu/dsc101/s11</url>
            <instructor>
                <abbreviation>Faculty</abbreviation>
                <fullName>Joe Faculty, Phd</fullName>
                <identifier>faculty</identifier>
            </instructor>
            <grade>A</grade>
            <credits>4</credits>
        </course>

        <course>
            <title>Precalculus</title>
            <code>MAT 170</code>
            <school>School of Design</school>
            <location>
                <displayName>Becton 101</displayName>
                <identifier>BCT</identifier>
            </location>
            <meetingTimes>M-W-F, 1:30-2:30pm</meetingTimes>
            <url>http://courses.university.edu/dsc101/s11</url>
            <instructor>
                <abbreviation>Faculty</abbreviation>
                <fullName>Joe Faculty, Phd</fullName>
                <identifier>faculty</identifier>
            </instructor>
            <grade>C</grade>
            <credits>4</credits>
        </course>

        <course>
            <title>Graphic Design History</title>
            <code>GRA 111</code>
            <school>School of Design</school>
            <location>
                <displayName>WLH 205</displayName>
                <identifier>WLH</identifier>
            </location>
            <meetingTimes>M-W-F, 1:30-2:30pm</meetingTimes>
            <url>http://courses.university.edu/dsc101/s11</url>
            <instructor>
                <abbreviation>Faculty</abbreviation>
                <fullName>Joe Faculty, Phd</fullName>
                <identifier>faculty</identifier>
            </instructor>
            <grade>A</grade>
            <credits>4</credits>
        </course>

    </term>

</course-summary>
